{
  "format": "gegner/1",
  "id": "haescher",
  "rolle": "haescher",
  "waffe": "betaeuber",
  "profil": "haescher",
  "namen": {
    "germanen": "Wergeld-Fänger",
    "rostmeute": "Wergeld-Fänger",
    "rom": "Fugitivarius"
  },
  "vornamen": {
    "rom": [
      "Ambrosius",
      "Cinna",
      "Dolabella",
      "Eutropius",
      "Faustus",
      "Glabrio",
      "Hortensius",
      "Julianus",
      "Kaeso",
      "Laenas",
      "Maximus",
      "Nepos",
      "Orestes",
      "Pudens",
      "Quadratus"
    ]
  },
  "beschreibung": "Folgt dem Niederhalter, betäubt und fesselt einzelne oder liegende Spieler. Wer gefangen wird, muss ausbrechen.",
  "funk": {
    "allgemein": [
      "Den nehm ich mit.",
      "Lebend!",
      "Das gibt gutes Wergeld.",
      "Haltet sie mir vom Leib, ich fessle!"
    ],
    "fesselt": [
      "Der schläft, ich binde ihn!"
    ],
    "gefesselt": [
      "Einer ist gebunden!"
    ],
    "kamerad_liegt": [
      "Hoch mit dir!",
      "Ich hol dich!"
    ],
    "spieler_gefesselt": [
      "Den haben wir!"
    ],
    "alarm_laerm": [
      "Das war ein Schuss! Alle wach!"
    ],
    "friendly_fire": [
      "Pass doch auf, du Narr!"
    ]
  },
  "funk_nach_fraktion": {
    "rom": {
      "allgemein": [
        "Den nehme ich in Gewahrsam.",
        "Lebend, so lautet der Befehl!",
        "Auf dem Markt bringt er gutes Geld.",
        "Deckt mich, ich lege die Fessel an!"
      ],
      "fesselt": [
        "Er schläft, ich lege die Fesseln an!"
      ],
      "gefesselt": [
        "Ein Mann in Fesseln!"
      ],
      "kamerad_liegt": [
        "Aufstehen, Soldat!",
        "Ich hole dich raus!"
      ],
      "spieler_gefesselt": [
        "Einer ist gefasst. Weiter!"
      ],
      "alarm_laerm": [
        "Schuss gefallen! Kohorte, Alarm!"
      ],
      "friendly_fire": [
        "Eigene Linie, Idiot! Augen auf!"
      ]
    }
  }
}
